[
  {
    "id": "inv_denial_1",
    "family": "TRACK_LEVEL",
    "title": "Denial: Coastal Sensor Grid",
    "text": "Layered sensors and hardened points raise the odds the Rival's fait accompli fails.",
    "cost": { "budget": 6, "politicalCapital": 0 },
    "leadTimeTurns": 2,
    "track": "denial",
    "level": 3,
    "maxPurchases": 1,
    "rationaleSetId": "rs_capability"
  },
  {
    "id": "inv_denial_2",
    "family": "TRACK_LEVEL",
    "title": "Denial: Mobile Defensive Fires",
    "text": "Dispersed, survivable fires that make a quick seizure prohibitively hard.",
    "cost": { "budget": 9, "politicalCapital": 1 },
    "leadTimeTurns": 3,
    "track": "denial",
    "level": 6,
    "maxPurchases": 1,
    "availability": { "gte": [{ "var": "tracks.denial" }, 3] },
    "rationaleSetId": "rs_capability"
  },
  {
    "id": "inv_punish_1",
    "family": "TRACK_LEVEL",
    "title": "Punishment: Long-Range Strike",
    "text": "A standoff strike complex that threatens costly retaliation after any aggression.",
    "cost": { "budget": 8, "politicalCapital": 1 },
    "leadTimeTurns": 3,
    "track": "punishment",
    "level": 3,
    "offensiveCoded": true,
    "maxPurchases": 1,
    "rationaleSetId": "rs_capability"
  },
  {
    "id": "inv_punish_2",
    "family": "TRACK_LEVEL",
    "title": "Punishment: Deep Interdiction",
    "text": "Extends retaliatory reach; raises war costs but reads as offensive to a nervous Rival.",
    "cost": { "budget": 11, "politicalCapital": 2 },
    "leadTimeTurns": 4,
    "track": "punishment",
    "level": 6,
    "offensiveCoded": true,
    "maxPurchases": 1,
    "availability": { "gte": [{ "var": "tracks.punishment" }, 3] },
    "rationaleSetId": "rs_capability"
  },
  {
    "id": "inv_intel_1",
    "family": "TRACK_LEVEL",
    "title": "Intelligence: ISR Expansion",
    "text": "More collection tightens your estimates — narrower error bars on the Rival's intent.",
    "cost": { "budget": 5, "politicalCapital": 0 },
    "leadTimeTurns": 2,
    "track": "intelligence",
    "level": 3,
    "maxPurchases": 1,
    "rationaleSetId": "rs_capability"
  },
  {
    "id": "inv_intel_2",
    "family": "TRACK_LEVEL",
    "title": "Intelligence: Fusion Cell",
    "text": "All-source fusion further reduces estimate noise and lifts reporting to high confidence.",
    "cost": { "budget": 8, "politicalCapital": 1 },
    "leadTimeTurns": 3,
    "track": "intelligence",
    "level": 6,
    "maxPurchases": 1,
    "availability": { "gte": [{ "var": "tracks.intelligence" }, 3] },
    "rationaleSetId": "rs_capability"
  },
  {
    "id": "inv_ready_1",
    "family": "TRACK_LEVEL",
    "title": "Readiness: Logistics & Sustainment",
    "text": "Prepositioned stocks and lift: the groundwork for faster mobilization. On its own it does not yet shorten lead times.",
    "cost": { "budget": 5, "politicalCapital": 0 },
    "leadTimeTurns": 2,
    "track": "readiness",
    "level": 3,
    "maxPurchases": 1,
    "rationaleSetId": "rs_capability"
  },
  {
    "id": "inv_ready_2",
    "family": "TRACK_LEVEL",
    "title": "Readiness: Rapid Reinforcement",
    "text": "A standing surge package that cuts a quarter off the lead time of later track investments.",
    "cost": { "budget": 9, "politicalCapital": 1 },
    "leadTimeTurns": 3,
    "track": "readiness",
    "level": 6,
    "maxPurchases": 1,
    "availability": { "gte": [{ "var": "tracks.readiness" }, 3] },
    "rationaleSetId": "rs_capability"
  }
]
